{
  "$schema": "https://json-schema.org/draft/2020-12/schema",
  "$id": "https://schemas.kumwe.org/studio/v1/media-reference.schema.json",
  "title": "Studio persisted media reference",
  "description": "A small, usage-specific reference stored in an artifact. It contains no URL, binary data, storage path, credential, or host delivery authority.",
  "type": "object",
  "additionalProperties": false,
  "required": ["contractVersion", "kind", "assetId", "usage", "accessibility"],
  "properties": {
    "contractVersion": { "$ref": "common.schema.json#/$defs/contractVersion" },
    "kind": { "const": "media-reference" },
    "assetId": { "$ref": "common.schema.json#/$defs/stableId" },
    "assetRevision": { "$ref": "common.schema.json#/$defs/revision" },
    "usage": { "$ref": "common.schema.json#/$defs/qualifiedName" },
    "renditionIntent": {
      "type": "object",
      "additionalProperties": false,
      "required": ["role"],
      "properties": {
        "role": { "$ref": "common.schema.json#/$defs/localName" },
        "fit": { "enum": ["contain", "cover", "fill", "scale-down"] },
        "preferredMediaTypes": {
          "type": "array",
          "maxItems": 10,
          "uniqueItems": true,
          "items": {
            "type": "string",
            "pattern": "^[a-z0-9!#$&^_.+-]+/[a-z0-9!#$&^_.+-]+(?![\\s\\S])",
            "maxLength": 200
          }
        }
      }
    },
    "focalPoint": {
      "type": "object",
      "additionalProperties": false,
      "required": ["x", "y"],
      "properties": {
        "x": { "type": "number", "minimum": 0, "maximum": 1 },
        "y": { "type": "number", "minimum": 0, "maximum": 1 }
      }
    },
    "cropIntent": {
      "oneOf": [
        {
          "type": "object",
          "additionalProperties": false,
          "required": ["mode", "width", "height"],
          "properties": {
            "mode": { "const": "aspect-ratio" },
            "width": { "type": "integer", "minimum": 1, "maximum": 10000 },
            "height": { "type": "integer", "minimum": 1, "maximum": 10000 }
          }
        },
        {
          "type": "object",
          "additionalProperties": false,
          "required": ["mode", "x", "y", "width", "height"],
          "properties": {
            "mode": { "const": "rectangle" },
            "x": { "type": "number", "minimum": 0, "maximum": 1 },
            "y": { "type": "number", "minimum": 0, "maximum": 1 },
            "width": { "type": "number", "exclusiveMinimum": 0, "maximum": 1 },
            "height": { "type": "number", "exclusiveMinimum": 0, "maximum": 1 }
          }
        }
      ]
    },
    "accessibility": {
      "oneOf": [
        {
          "type": "object",
          "additionalProperties": false,
          "required": ["mode", "altText"],
          "properties": {
            "mode": { "const": "informative" },
            "altText": { "type": "string", "minLength": 1, "maxLength": 5000 },
            "caption": { "type": "string", "maxLength": 20000 }
          }
        },
        {
          "type": "object",
          "additionalProperties": false,
          "required": ["mode"],
          "properties": {
            "mode": { "const": "decorative" }
          }
        },
        {
          "type": "object",
          "additionalProperties": false,
          "required": ["mode", "altFieldPath"],
          "properties": {
            "mode": { "const": "bound" },
            "altFieldPath": {
              "type": "array",
              "minItems": 1,
              "maxItems": 32,
              "items": { "$ref": "common.schema.json#/$defs/localName" }
            },
            "captionFieldPath": {
              "type": "array",
              "minItems": 1,
              "maxItems": 32,
              "items": { "$ref": "common.schema.json#/$defs/localName" }
            }
          }
        }
      ]
    }
  }
}
